carrier_name,job_title,zip_code,state,city,salary,home_time,experience_required,driver_type,freight_type,states_covered,description,carrier_hq_zip,carrier_hq_city,carrier_hq_state
Swift Transportation,CDL-A Truck Driver - Phoenix,85001,AZ,Phoenix,$1200 Weekly,Daily,0 Months,Company Driver,No Touch,"AZ,CA,NV","Long haul trucking position with competitive pay and benefits. Modern equipment and great home time.",85034,Phoenix,AZ
Walmart,CDL-A Driver - Opelika,36801,AL,Opelika,$1300 Weekly,Daily,6 Months,Company Driver,No Touch Freight,"AL,GA,FL","Walmart dedicated route with consistent schedule and excellent benefits.",72716,Bentonville,AR
Schneider,Regional Driver,,NC,Charlotte,$1100 Weekly,Home Daily,3 Months,Company Driver,Driver Unload,"NC,SC,VA","Regional routes with home time daily. No ZIP code - will use Schneider HQ in Green Bay.",53711,Green Bay,WI
JB Hunt,OTR Driver,,TX,Dallas,$1400 Weekly,Weekly,12 Months,Company Driver,Drop and Hook,"TX,OK,LA,AR","Over the road position with weekly home time. Great pay and benefits.",72762,Lowell,AR
Werner Enterprises,Dedicated Route,68127,NE,Omaha,$1250 Weekly,Weekly,6 Months,Company Driver,No Touch,"NE,IA,KS,MO","Dedicated customer route with consistent miles and schedule.",68127,Omaha,NE
